start	end	text
1.4235588972431077	6.0551378446115285	regola numero uno fate amicizia conoscete le persone l'università importante anche per il
6.280775623268698	11.294626038781164	network di gente che conoscete studiare in gruppo affrontare i periodi difficili in gruppo li rende
11.580985507246377	16.214376811594203	meno difficili più semplici più divertenti uscirete anche a pranzo o a cena vi divertirete un po'
16.18006230529595	20.814454828660438	è sempre bello avere due chiacchiere con i colleghi quindi coraggio fate amicizia anche se può essere
20.6	24.593400673400676	difficile per alcuni di voi perché io sono una persona timida anche se magari a voi non sembra
25.061492537313434	29.35426865671642	so quanto può essere difficile a volte andrà a parlare con uno sconosciuto ma credetemi quello
29.28	33.688185618729094	che guadagnate dopo in rapporti, momenti divertenti e belli ne vale davvero la pena
33.88164814814815	35.271125	Quindi, muovetevi e andate a fare amicizia.
