start	end	text
0.2807310704960836	5.714882506527416	percorsi in generale quindi quello che io preparavo in un mese al primo anno lo
5.8003458213256485	10.694409221902017	preparerei al sesto anno in dieci giorni in una settimana proprio perché avevo un
10.64	13.972528301886793	modo di studiare completamente differente e questo ovviamente dipende
13.96	18.01351170568562	molto al metodo di studio che magari si apprende col passare del tempo ma
18.220852459016395	22.113573770491804	soprattutto è una cosa che io all'inizio non riusciva a capire per me
22.341658066860468	25.501682412790696	dovevo solo studiare studiare in realtà bisogna si studiare ma bisogna
