start	end	text
0.06015665796344648	5.734934725848564	ti annoierò, sono arrivato tardi, mancavano 3-4 giorni, ancora questo monologo era in
5.68	11.234773333333333	alto mare, vado a letto, ero non so, le 11, mezzanotte, non prendevo sonno, non
11.200000000000001	15.934174174174178	prendevo sonno perché l'ansia mi vinceva, allora invece di tentare di addormentarmi
16.341233243967828	21.45490616621984	mi sono alzato, mi sono messo al computer, ho cominciato a leggere, a scrivere, a
21.60071052631579	29.74475	preparare il monologo dopo 1-2 ore, qualcosa avevo combinato
