start	end	text
0.10025062656641603	6.295739348370927	Quello era il glorioso LG G5, c'era anche io qualche anno fa e ci sono di nuovo adesso,
6.8420240963855425	12.575807228915663	molto meno glorioso di LG G5, con qualche capello bianco in più, ma estremamente contento di essere
12.721108033240997	17.61462603878116	qui, sono di nuovo in tutto Android, questo è vero, ma se volete tutti i dettagli di questo
17.920925449871465	23.394961439588688	cambiamento, abbiamo fatto una live di fine anno, la trovate su YouTube e lì vi abbiamo raccontato
23.36	25.26496083550914	un pochino più dettagliatamente che cosa è successo e come mai io sono di nuovo qui, ma vado
29.240512295081967	31.48625	le ciance perché l'argomento di oggi è estremamente importante.
