start	end	text
0.0801909307875895	6.2548926014319814	Però poi ho detto tutte quelle cose che non sono riuscite assolutamente a coinvolgermi.
6.4200626959247655	10.633228840125392	E quando un film non mi coinvolge, automaticamente, non mi piace.
11.942753623188407	16.85458937198068	Quello è un altro modo di eseguire un'analisi, cioè dire mi ha fatto schifo,
17.42110726643599	20.893079584775087	però c'è da dire che questo è bello, questo è bello, questo è bello, questo è bello.
20.900000000000002	24.292565055762083	È un'analisi che poche persone riescono a comprendere, vanno fuori di teste.
24.3	27.231726907630524	Infatti molti hanno preso quel video come una bocciatura,
27.480365853658537	34.875365853658536	Cioè, ci hanno letto, Birdman è una merda, no, però Birdman mi fa cagare, mi fa cagare,
35.160000000000004	41.73487528344671	non lo riguarderò mai nella vita, lo considererei tempo estremamente sprecato, per quello che mi riguarda.
43.68628278688524	45.39264036885246	L'emozioni sono quelle che fanno...
